{
  "schema": "strategy-v5-dated-futures-catalog/2",
  "version": 2,
  "captured_at": "2026-08-25T12:11:02.000Z",
  "source": {
    "endpoint": "https://s3-ap-northeast-1.amazonaws.com/data.binance.vision",
    "listing_response_set_sha256": "38d9018c5e1637f783a42065a77f5c7bebe82d620b6b8617a94401f76e40ff65",
    "listing_format": "S3_XML_DELIMITER",
    "persistence_status": "RAW_RECEIPTS_BOUND",
    "raw_output_root_reference": "strategy-research/v5-raw/backfill-20260825",
    "raw_receipts": [
      {
        "schema": "strategy-v5-source-receipt/1",
        "version": 1,
        "path": "raw/3ab6d7fb1fe6ca3fb558c4873fa1dae4ae816768570e33af59e7722744e9afff.bin",
        "source": "BINANCE_DATA_VISION_S3",
        "request": {
          "endpoint": "https://s3-ap-northeast-1.amazonaws.com/data.binance.vision?delimiter=%2F&prefix=data%2Ffutures%2Fum%2Fmonthly%2Fklines%2FBTCUSDT_",
          "listing_format": "S3_XML_DELIMITER"
        },
        "byte_sha256": "3ab6d7fb1fe6ca3fb558c4873fa1dae4ae816768570e33af59e7722744e9afff",
        "bytes": 2612,
        "format": "RAW_BYTES",
        "storage_role": "RAW_IGNORED",
        "authoritative": false,
        "content_sha256": "d8464389273192417463fe5dbdef74a6338ca0dbddc40e19e33cb99a1f8db745"
      },
      {
        "schema": "strategy-v5-source-receipt/1",
        "version": 1,
        "path": "raw/1acf7f5240743db936d7ec6acc3afc346dbaecda02ef0c3db265678f594217a5.bin",
        "source": "BINANCE_DATA_VISION_S3",
        "request": {
          "endpoint": "https://s3-ap-northeast-1.amazonaws.com/data.binance.vision?delimiter=%2F&prefix=data%2Ffutures%2Fum%2Fmonthly%2Fklines%2FETHUSDT_",
          "listing_format": "S3_XML_DELIMITER"
        },
        "byte_sha256": "1acf7f5240743db936d7ec6acc3afc346dbaecda02ef0c3db265678f594217a5",
        "bytes": 2612,
        "format": "RAW_BYTES",
        "storage_role": "RAW_IGNORED",
        "authoritative": false,
        "content_sha256": "e9c55a62bd12479376b6a1df4db094736dca536a66c43f9d182a9a8c51699489"
      }
    ],
    "raw_receipt_sha256": [
      "d8464389273192417463fe5dbdef74a6338ca0dbddc40e19e33cb99a1f8db745",
      "e9c55a62bd12479376b6a1df4db094736dca536a66c43f9d182a9a8c51699489"
    ],
    "raw_receipt_byte_sha256": [
      "1acf7f5240743db936d7ec6acc3afc346dbaecda02ef0c3db265678f594217a5",
      "3ab6d7fb1fe6ca3fb558c4873fa1dae4ae816768570e33af59e7722744e9afff"
    ]
  },
  "requested_assets": [
    "aave",
    "ada",
    "bnb",
    "btc",
    "eth",
    "link",
    "sol",
    "xrp"
  ],
  "contracts": [
    {
      "asset": "btc",
      "symbol": "BTCUSDT_210924",
      "contract_type": "QUARTERLY_EXPIRED_OR_HISTORICAL",
      "venue": "BINANCE",
      "instrument": "BINANCE_USDM_DATED_FUTURE",
      "first_bar_at": "2021-08-25T04:00:00.000Z",
      "last_bar_at": "2021-09-24T08:00:00.000Z",
      "expiry_observed_date_utc": "2021-09-24",
      "expiry_at": null,
      "expiry_binding_status": "UNAVAILABLE",
      "contract_spec_status": "UNAVAILABLE",
      "history_status": "SIGNAL_HISTORY_AVAILABLE",
      "tradeable": false,
      "source_prefix": "data/futures/um/monthly/klines/BTCUSDT_210924/",
      "source_raw_byte_sha256": "3ab6d7fb1fe6ca3fb558c4873fa1dae4ae816768570e33af59e7722744e9afff",
      "archive_ingestion_status": "ARCHIVE_DISCOVERED_NOT_INGESTED",
      "source_listing_response_byte_sha256": [
        "3ab6d7fb1fe6ca3fb558c4873fa1dae4ae816768570e33af59e7722744e9afff"
      ],
      "source_receipt_sha256": [
        "d8464389273192417463fe5dbdef74a6338ca0dbddc40e19e33cb99a1f8db745"
      ]
    },
    {
      "asset": "btc",
      "symbol": "BTCUSDT_211231",
      "contract_type": "QUARTERLY_EXPIRED_OR_HISTORICAL",
      "venue": "BINANCE",
      "instrument": "BINANCE_USDM_DATED_FUTURE",
      "first_bar_at": "2021-09-22T00:00:00.000Z",
      "last_bar_at": "2021-12-31T08:00:00.000Z",
      "expiry_observed_date_utc": "2021-12-31",
      "expiry_at": null,
      "expiry_binding_status": "UNAVAILABLE",
      "contract_spec_status": "UNAVAILABLE",
      "history_status": "SIGNAL_HISTORY_AVAILABLE",
      "tradeable": false,
      "source_prefix": "data/futures/um/monthly/klines/BTCUSDT_211231/",
      "source_raw_byte_sha256": "3ab6d7fb1fe6ca3fb558c4873fa1dae4ae816768570e33af59e7722744e9afff",
      "archive_ingestion_status": "ARCHIVE_DISCOVERED_NOT_INGESTED",
      "source_listing_response_byte_sha256": [
        "3ab6d7fb1fe6ca3fb558c4873fa1dae4ae816768570e33af59e7722744e9afff"
      ],
      "source_receipt_sha256": [
        "d8464389273192417463fe5dbdef74a6338ca0dbddc40e19e33cb99a1f8db745"
      ]
    },
    {
      "asset": "btc",
      "symbol": "BTCUSDT_220325",
      "contract_type": "QUARTERLY_EXPIRED_OR_HISTORICAL",
      "venue": "BINANCE",
      "instrument": "BINANCE_USDM_DATED_FUTURE",
      "first_bar_at": "2021-12-24T00:00:00.000Z",
      "last_bar_at": "2022-03-25T08:00:00.000Z",
      "expiry_observed_date_utc": "2022-03-25",
      "expiry_at": null,
      "expiry_binding_status": "UNAVAILABLE",
      "contract_spec_status": "UNAVAILABLE",
      "history_status": "SIGNAL_HISTORY_AVAILABLE",
      "tradeable": false,
      "source_prefix": "data/futures/um/monthly/klines/BTCUSDT_220325/",
      "source_raw_byte_sha256": "3ab6d7fb1fe6ca3fb558c4873fa1dae4ae816768570e33af59e7722744e9afff",
      "archive_ingestion_status": "ARCHIVE_DISCOVERED_NOT_INGESTED",
      "source_listing_response_byte_sha256": [
        "3ab6d7fb1fe6ca3fb558c4873fa1dae4ae816768570e33af59e7722744e9afff"
      ],
      "source_receipt_sha256": [
        "d8464389273192417463fe5dbdef74a6338ca0dbddc40e19e33cb99a1f8db745"
      ]
    },
    {
      "asset": "btc",
      "symbol": "BTCUSDT_220624",
      "contract_type": "QUARTERLY_EXPIRED_OR_HISTORICAL",
      "venue": "BINANCE",
      "instrument": "BINANCE_USDM_DATED_FUTURE",
      "first_bar_at": "2022-03-22T00:00:00.000Z",
      "last_bar_at": "2022-06-24T08:00:00.000Z",
      "expiry_observed_date_utc": "2022-06-24",
      "expiry_at": null,
      "expiry_binding_status": "UNAVAILABLE",
      "contract_spec_status": "UNAVAILABLE",
      "history_status": "SIGNAL_HISTORY_AVAILABLE",
      "tradeable": false,
      "source_prefix": "data/futures/um/monthly/klines/BTCUSDT_220624/",
      "source_raw_byte_sha256": "3ab6d7fb1fe6ca3fb558c4873fa1dae4ae816768570e33af59e7722744e9afff",
      "archive_ingestion_status": "ARCHIVE_DISCOVERED_NOT_INGESTED",
      "source_listing_response_byte_sha256": [
        "3ab6d7fb1fe6ca3fb558c4873fa1dae4ae816768570e33af59e7722744e9afff"
      ],
      "source_receipt_sha256": [
        "d8464389273192417463fe5dbdef74a6338ca0dbddc40e19e33cb99a1f8db745"
      ]
    },
    {
      "asset": "btc",
      "symbol": "BTCUSDT_220930",
      "contract_type": "QUARTERLY_EXPIRED_OR_HISTORICAL",
      "venue": "BINANCE",
      "instrument": "BINANCE_USDM_DATED_FUTURE",
      "first_bar_at": "2022-06-20T00:00:00.000Z",
      "last_bar_at": "2022-09-30T08:00:00.000Z",
      "expiry_observed_date_utc": "2022-09-30",
      "expiry_at": null,
      "expiry_binding_status": "UNAVAILABLE",
      "contract_spec_status": "UNAVAILABLE",
      "history_status": "SIGNAL_HISTORY_AVAILABLE",
      "tradeable": false,
      "source_prefix": "data/futures/um/monthly/klines/BTCUSDT_220930/",
      "source_raw_byte_sha256": "3ab6d7fb1fe6ca3fb558c4873fa1dae4ae816768570e33af59e7722744e9afff",
      "archive_ingestion_status": "ARCHIVE_DISCOVERED_NOT_INGESTED",
      "source_listing_response_byte_sha256": [
        "3ab6d7fb1fe6ca3fb558c4873fa1dae4ae816768570e33af59e7722744e9afff"
      ],
      "source_receipt_sha256": [
        "d8464389273192417463fe5dbdef74a6338ca0dbddc40e19e33cb99a1f8db745"
      ]
    },
    {
      "asset": "btc",
      "symbol": "BTCUSDT_221230",
      "contract_type": "QUARTERLY_EXPIRED_OR_HISTORICAL",
      "venue": "BINANCE",
      "instrument": "BINANCE_USDM_DATED_FUTURE",
      "first_bar_at": "2022-09-23T00:00:00.000Z",
      "last_bar_at": "2022-12-30T08:00:00.000Z",
      "expiry_observed_date_utc": "2022-12-30",
      "expiry_at": null,
      "expiry_binding_status": "UNAVAILABLE",
      "contract_spec_status": "UNAVAILABLE",
      "history_status": "SIGNAL_HISTORY_AVAILABLE",
      "tradeable": false,
      "source_prefix": "data/futures/um/monthly/klines/BTCUSDT_221230/",
      "source_raw_byte_sha256": "3ab6d7fb1fe6ca3fb558c4873fa1dae4ae816768570e33af59e7722744e9afff",
      "archive_ingestion_status": "ARCHIVE_DISCOVERED_NOT_INGESTED",
      "source_listing_response_byte_sha256": [
        "3ab6d7fb1fe6ca3fb558c4873fa1dae4ae816768570e33af59e7722744e9afff"
      ],
      "source_receipt_sha256": [
        "d8464389273192417463fe5dbdef74a6338ca0dbddc40e19e33cb99a1f8db745"
      ]
    },
    {
      "asset": "btc",
      "symbol": "BTCUSDT_230331",
      "contract_type": "QUARTERLY_EXPIRED_OR_HISTORICAL",
      "venue": "BINANCE",
      "instrument": "BINANCE_USDM_DATED_FUTURE",
      "first_bar_at": "2022-12-23T00:00:00.000Z",
      "last_bar_at": "2023-03-31T08:00:00.000Z",
      "expiry_observed_date_utc": "2023-03-31",
      "expiry_at": null,
      "expiry_binding_status": "UNAVAILABLE",
      "contract_spec_status": "UNAVAILABLE",
      "history_status": "SIGNAL_HISTORY_AVAILABLE",
      "tradeable": false,
      "source_prefix": "data/futures/um/monthly/klines/BTCUSDT_230331/",
      "source_raw_byte_sha256": "3ab6d7fb1fe6ca3fb558c4873fa1dae4ae816768570e33af59e7722744e9afff",
      "archive_ingestion_status": "ARCHIVE_DISCOVERED_NOT_INGESTED",
      "source_listing_response_byte_sha256": [
        "3ab6d7fb1fe6ca3fb558c4873fa1dae4ae816768570e33af59e7722744e9afff"
      ],
      "source_receipt_sha256": [
        "d8464389273192417463fe5dbdef74a6338ca0dbddc40e19e33cb99a1f8db745"
      ]
    },
    {
      "asset": "btc",
      "symbol": "BTCUSDT_230630",
      "contract_type": "QUARTERLY_EXPIRED_OR_HISTORICAL",
      "venue": "BINANCE",
      "instrument": "BINANCE_USDM_DATED_FUTURE",